{
  "$schema": "https://json-schema.org/draft/2020-12/schema",
  "$id": "https://repo-circuit.dev/schemas/comparison-manifest.schema.json",
  "title": "RepoCircuit Comparison Manifest",
  "type": "object",
  "additionalProperties": false,
  "allOf": [
    {
      "if": {
        "properties": {
          "status": {
            "const": "valid_for_attribution"
          }
        }
      },
      "then": {
        "properties": {
          "changedVariables": {
            "minItems": 1,
            "maxItems": 1
          },
          "reasons": {
            "maxItems": 0
          }
        }
      }
    },
    {
      "if": {
        "properties": {
          "status": {
            "const": "invalid_for_attribution"
          }
        }
      },
      "then": {
        "properties": {
          "reasons": {
            "minItems": 1
          }
        }
      }
    }
  ],
  "required": [
    "schemaVersion",
    "comparisonId",
    "runAId",
    "runBId",
    "changedVariables",
    "status",
    "reasons"
  ],
  "properties": {
    "schemaVersion": {
      "const": 1
    },
    "comparisonId": {
      "type": "string",
      "minLength": 1
    },
    "runAId": {
      "type": "string",
      "minLength": 1
    },
    "runBId": {
      "type": "string",
      "minLength": 1
    },
    "changedVariables": {
      "type": "array",
      "uniqueItems": true,
      "items": {
        "type": "string",
        "minLength": 1
      }
    },
    "status": {
      "type": "string",
      "enum": [
        "valid_for_attribution",
        "invalid_for_attribution"
      ]
    },
    "reasons": {
      "type": "array",
      "items": {
        "type": "string",
        "minLength": 1
      }
    }
  }
}
