{
  "schemaVersion": 1,
  "comparisonId": "w3-confounded-model-and-prompt",
  "runAId": "w3-confounded-a",
  "runBId": "w3-confounded-b",
  "changedVariables": [
    "model.modelId",
    "prompt.systemPromptHash"
  ],
  "status": "invalid_for_attribution",
  "reasons": [
    "changed_variables_must_contain_exactly_one_item: received_2"
  ]
}
